{
  "$schema": "./docs/harness/harness.schema.json",
  "version": 1,
  "project": "MindSpace",
  "currentPhase": "phase-6-production-hardening",
  "sources": {
    "product": "requirement.md",
    "visualReference": "poc.html",
    "agentEntryPoint": "AGENTS.md"
  },
  "requiredDocuments": [
    "docs/harness/README.md",
    "docs/harness/product-scope.md",
    "docs/harness/architecture.md",
    "docs/harness/engineering-rules.md",
    "docs/harness/workflow.md",
    "docs/harness/testing.md",
    "docs/harness/security-and-ai-safety.md",
    "docs/harness/definition-of-done.md",
    "docs/harness/decisions/0001-initial-architecture.md",
    "docs/harness/decisions/0002-firebase-persistence.md",
    "docs/harness/decisions/0004-firestore-board-schema.md",
    "docs/harness/decisions/0005-private-sync-links.md",
    "docs/harness/decisions/0006-board-image-files.md",
    "docs/harness/decisions/0013-email-password-account-linking.md",
    "docs/harness/decisions/0014-text-alignment-and-tool-defaults.md",
    "storage.rules"
  ],
  "validation": {
    "harness": "node scripts/validate-harness.mjs",
    "application": ["lint", "typecheck", "test", "build"]
  }
}
